number,status,sk_description,supplier_number,supplier_description,minimum_po_quantity,purchase_unit,stock_unit,pur_stk_conversion,price_per_stock_unit,price_per_purchase_unit,supplier_id
0235,Active,Film BOPP Fuji 14.5 in Web,BOPP 14.5 Web,Film BOPP Fuji 14.5 in Web,9842,FT,IN,12,0.0008,0.0096,61
0236,Obsolete,U Pad 5 X 7 Hamburger Firenza,1.02935E+11,U Pad 5 X 7 Hamburger Firenza,18,K,EA,1000,0.0471,47.1,17
0237,Obsolete,Film BOPP Fuji 15 in Web,15 Web,15 5,No Control,70860,FT,IN,0.0004,0,60
0238,Active,Tray Entree Black CPET 12 Oz,GPC-5066-12,GPC-5066-12 Tray 12z Blk CPET,1,CS,EA,600,0.075,45,17
0239,Obsolete,Carton OP Dipper Corn Dog,OP Dipper Corn Dog,Carton OP Dipper Corn Dog,1,EA,EA,1,0.0898,0.0898,17
0240,Obsolete,Carton OP Dipper Popcorn Chick,OP Dipper Pop Chick,Carton OP Dipper Popcorn Chick,1,EA,EA,1,0.0898,0.0898,17
0241,Obsolete,Carton OP Dipper Chicken Ched,OP Dipper Chick Ched,Carton OP Dipper Chicken Ched,1,EA,EA,1,0.0898,0.0898,17
0242,Obsolete,Box Master OP 18Pk Lunch Dippr,OP Master 18 Pk Dip,Box Master OP 18Pk Lunch Dippr,1,EA,EA,1,0.3167,0.3167,17
0243,Obsolete,Ketchup Cup 1 Oz Dipper,98877,Ketchup Cup 1 Oz Dipper,0,CS,EA,160,0.0622,9.952,62
0244,Obsolete,Nuggets Chix N Cheddar .55 Oz,251BP,Chicken   Ched Nibblers .55 Oz,0,CS,EA,1160,0.0476,55.216,63
0245,Obsolete,Chicken Popcorn 20 Lb,20300,Chicken Popcorn 20 Lb,0,CS,OZ,320,0.0894,28.608,63
0246,Obsolete,Nugget Corn Dog .67 Oz,20042,Corn Dog Nuggets .67 Oz,0,CS,EA,238,0.0563,13.3994,64
0248,Obsolete,Cheese Havarti Sliced 1 Oz,16687,Cheese Havarti Sliced 1 Oz,25,CS,EA,192,0.2025,38.88,9
0249,Obsolete,Egg White Patty 1.67 oz,70064,Egg White Patty 192-1.67 Oz,0,CS,EA,192,0.133,25.536,7
0250,Obsolete,Egg Patty Scrambled 1.67 oz,70061,Egg Patty Scrambled 1.67 OZ,0,CS,EA,168,0.1186,19.9248,7
0251,Active,Bacon Uncured Slcd 2-150 EA,12604-14,Bacon Uncured Slcd 2-150 EA,0,CS,EA,300,0.1019,30.57,8
0252,Active,Loaf Panini White,230995,Loaf Panini White 16 SL/Loaf,0,CS,EA,256,0.072,18.432,65
0252,Active,Loaf Panini White,2771,SK White Panini Loaf,0,CS,EA,300,0.072,21.6,28
0253,Active,Beef Seas Diced .5inx.5in,B21CB1915,Ckd Seas Beef w/ Starch,0,CS,LB,35,3.93,137.55,66
0254,Active,Chicken Ckd Diced .5in x.5in,14200,Diced 1/2in Chicken White Meat,0,CS,LB,10,3.43,34.3,67
0255,Active,Chicken Seas Diced .5in x.5in,111348,Seas Diced 1/2in Chic Brst Mt,0,CS,LB,10,3.18,31.8,67
0256,Active,Onion Diced 1/4in Crmlzd ,70640100,Onion Diced 1/4in Crmlzd ,0,CS,OZ,400,0.1069,42.76,34
0257,Active,Onion Diced 1/2in Rstd,70650080,Onion Diced 1/2in Rstd,0,CS,OZ,400,0.1094,43.76,34
0258,Active,Pepper Green Strip Rstd,70653035,Pepper Green Strip Rstd,0,CS,OZ,320,0.1124,35.968,34
0259,Active,Pepper Strip Red Rstd,70653155,Pepper Strip Red Rstd,1,CS,OZ,320,0.1124,35.968,34
0260,Active,Mushroom Diced 1/2in Rstd,70658018,Mushroom Diced 1/2in Rstd,0,CS,OZ,400,0.1611,64.44,34
0261,Active,Bacon Bits 3/16in Dice,37295,Fast N Easy Bacon Bits Diced,0,CS,OZ,320,0.2791,89.312,46
0262,Active,Chile Poblana IQF 1/4in,11080,Chile Poblana IQF 1/4in,1,CS,OZ,720,0.0874,62.928,22
0263,Active,Tomato RM IQF Diced 3/8in,16543,Tomato RM IQF Diced 3/8in,1,CS,OZ,720,0.0969,69.768,22
0264,Active,Susceptor Micro Grill Panini,SK 6.5 Micro Grill,Susceptor Micro Grill Panini,10000,EA,EA,1,0.0829,0.0829,30
0265,Active,Flavor Beef Nat Art SB,44700 89719,Nat   Art Beef Flavor SB,0,PL,OZ,560,1.0838,606.928,68
0266,Active,Cheese Shred RF Mozz,4610033644,6/5# Bevel Shred RF Mozz,0,CS,OZ,480,0.1413,67.824,31
0267,Active,Cheese Grtd Rom/Parm/Asiago,4610033643,50 Lb Grated Rom/Parm/Asiago,0,CS,OZ,800,0.2295,183.6,31
0268,Active,Spread Asiago Processed,4610033809,18/20 Oz Asiago Spread NTF,0,CS,OZ,360,0.1421,51.156,31
0269,Active,Spread Cheddar Cheese,4610033811,18/20 Oz Cheddar Cheese Spread,0,CS,OZ,360,0.1268,45.648,31
0270,Active,Starch Ultra Sperse M,50-3012,Ultra-Sperse M 50 Lb Bag,0,BOX,OZ,800,0.1156,92.48,69
0271,Active,Spread Cream Cheese American,8357,Spread Cream Cheese American,1,CS,OZ,480,0.1159,55.632,9
0272,Active,Tray Panini No Print Uncoated,Panini Tray,Tray Panini No Print Uncoated,0,EA,EA,1,0.0786,0.0786,55
0272,Active,Tray Panini No Print Uncoated,0488-0904,Tray Panini No Print,10000,EA,EA,1,0.0786,0.0786,17
0273,Active,Ctn HEB Panini Mush Stk Ched,Ctn Panini Steak,Ctn HEB Panini Mush Stk Ched,1,EA,EA,1,0.0991,0.0991,17
0274,Active,Ctn HEB Panini Philly Stk,Ctn Panini Philly,Ctn HEB Panini Philly Stk,1,EA,EA,1,0.14,0.14,17
0275,Active,Ctn HEB Panini Chick Spin Mush,Ctn Panini Chik Spin,Ctn HEB Panini Chick Spin Mush,1,EA,EA,1,0.14,0.14,17
0276,Active,Ctn HEB Panini Poblano Chicken,Ctn Panini Chicken,Ctn HEB Panini Poblano Chicken,1,EA,EA,1,0.14,0.14,17
0277,Active,Spread Chipotle Flavor Conc,8410953,Flavor Conc Chipotle PPR,0,CS,OZ,86.4,0.4774,41.24736,1
0278,Active,Spread Ranch Fat Free,4142301552,4/1 Gal Fat Free Ranch,0,CS,OZ,512,0.0637,32.6144,70
0279,Active,Ham Blk Frst Log Unsliced SBUX,4150,4-6 Lb (Catch),0,LB,LB,1,3.4,3.4,10
0280,Active,Pepper Red Diced 1/4in,70653214,Fire Rstd 1/4in Diced Red Pprs,0,CS,OZ,720,0.0968,69.696,34
0280,Active,Pepper Red Diced 1/4in,16717 - 45 Lbs,Rstd Red Bell Pepper 1/4 Dice,0,CS,OZ,720,0.0968,69.696,22
0281,Active,Ctn Panini Chicken Club,Ctn Panini Chic Club,Carton Panini Chicken Club,1,EA,EA,1,0.0991,0.0991,17
0282,Obsolete,Ctn Panini Philly Stk Chs,Ctn Panini Phlly Stk,Carton Panini Philly Stk Chs,1,EA,EA,1,0.0991,0.0991,17
0283,Obsolete,Ctn Panini Chicken Spinach,Ctn Panini Chic Spin,Carton Panini Chicken Spinach,1,EA,EA,1,0.0991,0.0991,17
0284,Obsolete,Ctn Panini Chicken Poblano,Ctn Panini Chic Pobl,Carton Panini Chicken Poblano,1,EA,EA,1,0.0991,0.0991,17
0285,Obsolete,Insert Pepperoni Saus 5 to 1,112318,Pepperoni Skinless Saus 5 to 1,1,CS,EA,50,0.434,21.7,32
0286,Active,Beef Hamburger Patty 2.6oz,2.6 Oz Patty,Beef Hamburger Patty 2.6oz,0,CS,EA,247,0.4421,109.1987,71
0287,Active,Hot Dog Nathans 5-1 6in,36906-97115,Nathans 5-1 6in Skls Bf Frank,0,CS,EA,50,0.47,23.5,72
0288,Active,Film Baguetta Nathans Hot Dog,SKFG Nathans HD,Film Baguetta Nathans Hot Dog,0,RL,IMP,4000,0.0877,350.8,59
0289,Active,Film Baguetta OP Pepperoni,SKFG OP Pepperoni,Film Baguetta OP Pepperoni,0,RL,IMP,4000,0.0877,350.8,59
0290,Obsolete,Cheese Havarti Sliced .5 Oz,13196,10/1# Intrlf 22 Sl Havarti .5z,0,CS,EA,320,0.1055,33.76,9
0291,Obsolete,Spread Herb   Chs Florentine,ZSKS009-005,Herb Cheese Spread,0,CS,OZ,640,0.2132,136.448,73
0292,Active,Polish Hot Bf Nathans 5-1 6in,36906-97116,Nathans 5-1 6in Hot Bf Polish,0,CS,EA,50,0.49,24.5,72
0293,Active,Hot Dog Nathans 7-1 6.75in,36906-97107,Nathans 7-1 6.75in Skls Bf,0,CS,EA,70,0.3357,23.499,72
0294,Obsolete,Hot Dog Nathans 8-1 6NATFAM,Nathans 8-1 6 Skls Bf Frank,No Control,CS,EA,80,,0,0,1000
0295,Active,Hot Dog Nathans 10-1 6in,36906-97113,Nathans 10-1 6in Skls Bf Frnk,0,CS,EA,100,0.235,23.5,72
0297,Active,Bun Hot Dog Plain 6in,53619,Plain Hot Dog Buns 12 Ct,0,CS,EA,144,0.1177,16.9488,74
0298,Active,Sauce Hot Dog Chili Sauce 1 Oz,MJ13100,Hot Dog Chili Sauce 1 Oz,1,CS,EA,288,0.1294,37.2672,53
0299,Active,Film Baguetta OP Pepperoni CAN,SKFG OP Pepp CAN,Film Baguetta OP Pepperoni CAN,0,RL,IMP,4000,0.0877,350.8,59
0300,Active,Tray Nathans Hot Dog Single,CS-9234,Tray Nathans Hot Dog Single,0,CS,EA,1000,0.0376,37.6,72
0301,Active,Tray Nathans Hot Dog Double,FT-9143,Tray Nathans Hot Dog Double,0,CS,EA,500,0.0751,37.55,72
0302,Active,Film Fuji Nathans Chili Dog,Chili HD Single,Film Fuji Nathans Chili Dog,0,RL,IMP,9000,0.0401,360.9,59
0303,Active,Film Fuji Nathans Chl Dog Twin,Chili HD Twin,Film Fuji Nathans Chl Dog Twin,0,RL,IMP,9000,0.0531,477.9,59
0304,Active,Film Fuji Nathans Bf Hot Dog,Beef Hot Dog Single,Film Fuji Nathans Bf Hot Dog,0,RL,IMP,9000,0.0401,360.9,59
0305,Active,Film Fuji Nathans Bf Dog Twin,Beef HD Twin,Film Fuji Nathans Bf Dog Twin,0,RL,IMP,9000,0.0531,477.9,59
0306,Active,Film Fuji Nathans Jumbo Bf HD,Jumbo Beef HD,Film Fuji Nathans Jumbo Bf HD,0,RL,IMP,9000,0.0401,360.9,59
0307,Active,Film Fuji Nathans Jumbo Spicy,Jumbo Spicy HD,Film Fuji Nathans Jumbo Spicy,0,RL,IMP,9000,0.0401,360.9,59
0308,Obsolete,Sauce Spin and Artichk Portion,SN7020,Spinach Artichoke Sauce,0,CS,EA,576,0.1287,74.1312,53
0309,Active,Film Tiro OP Tuna Dbl Wdg CAN,0309 OP Tuna Dbl CAN,Film Tiro OP Tuna Dbl Wdg CAN,0,RL,EA,15603,0.0437,681.8511,20
0310,Active,Film Tiro OP Hm Tky Sw Dbl CAN,0310 OP Ham Dbl CAN,Film Tiro OP Hm Tky Sw Dbl CAN,0,RL,EA,15603,0.0437,681.8511,20
0311,Active,Chicken Crumble Ckd Chorizo,B20-CC3398,Ckd Chicken Crumble Chrzo Seas,0,CS,LB,30,2.79,83.7,66
0312,Active,Turkey Crumble Seasoned,B20-CT3434,Ckd Seasoned Turkey Crumble,0,CS,LB,30,2.96,88.8,66
0313,Active,Egg Scrmbld IQF Chol FF,LL3014SK,Egg Scrmbld IQF Chol FF,0,CS,OZ,320,0.0814,26.048,35
0314,Active,Tortilla Salsa Homestyle 9in,F-IF-9in Salsa,Tortilla Salsa Homestyle 9in,0,CS,EA,144,0.1465,21.096,75
0315,Active,Tortilla White Homestyle 9in,F-IF-9in Home,Tortilla White Homestyle 9in,0,CS,EA,144,0.1452,20.9088,75
0316,Active,Tortilla Whl Wht Homestyle 9in,F-IF-9in WW,Tortilla Whl Wht Homestyle 9in,0,CS,EA,168,0.1452,24.3936,75
0317,Active,Corn/Pepper/Blk Bean Blend,70690518,Corn/Pepper/Blk Bean Blend,0,CS,OZ,400,0.1213,48.52,34
0318,Obsolete,Potato Popcorn 12-24 Oz,MCR04624,Potato Popcorn 12-24 Oz,1,CS,OZ,288,0.097,27.936,34
0319,Active,Spread Cream Cheese Asiago,8804,Spread Cream Cheese Asiago,0,CS,OZ,480,0.1159,55.632,9
0320,Active,Cheese Ched Med Shred 4-5 LB,11901,Cheese Ched Med Shred 4-5 LB,0,CS,LB,20,2.79,55.8,49
0321,Active,Cheese Mozz Shred 12-2 LB,11321,Cheese Mozz Shred 12-2 LB,0,CS,LB,24,3.5567,85.3608,49
0322,Active,Film Forming Map Pillow 9 Mil,9 Mil Forming SKFG,Film Map Pillow 9 Mil,0,RL,IN,14400,0.0179,257.76,59
0323,Obsolete,Cheese Shred LMPS Mozz 6/5 LB,SAR-4610033706,Cheese Shred LMPS Mozz 6/5 LB,0,CS,OZ,480,0.1569,75.312,31
0324,Active,Lbl Direct Thermal 4x6 Blank,B2069358100DT40018,LBL Direct Thermal 4x6 Blank,0,CS,EA,2000,0.0202,40.4,25
0325,Active,Pallet AHOLD Grd A #1 Wht Wood,#1 40x48 White,Pallet AHOLD Grd A #1 Wht Wood,0,EA,EA,1,10,10,76
0326,Obsolete,Egg Frittata Chs Veg 200-1.75Z,85428,Egg Frittata Chs Veg 200-1.75Z,0,CS,EA,200,0.245,49,7
0327,Active,Cheese Mont Jack Slcd 1 Oz,47775,Cheese Mont Jack Slcd 1 Oz,0,CS,EA,256,0.1627,41.6512,9
0328,Active,Film SBUX 9.5in Spinach Wrap,SKSW95,Film SBUX 9.5in Spinach Wrap,0,RL,IMP,12500,0.0086,107.5,61
0329,Active,Film SBUX 12in Bacon Artisan,SKBA12,Film SBUX 12in Bacon Artisan,0,RL,IMP,16500,0.0079,130.35,61
0330,Active,Film SBUX 12in Ham Artisan,SKHA12,Film SBUX 12in Ham Artisan,0,RL,IMP,16500,0.0079,130.35,61
0331,Active,Film SBUX 12in Veg Artisan,SKVA12,Film SBUX 12in Veg Artisan,0,RL,IMP,16500,0.0079,130.35,61
0332,Active,Film SBUX 14.5in Sausge Muffin,SKSM145,Film SBUX 14.5in Sausge Muffin,0,RL,IMP,15000,0.0106,159,61
0333,Active,Film SBUX 14.5in RF Trkey Bacn,SKTB145,Film SBUX 14.5in RF Trkey Bacn,0,RL,IMP,15000,0.0106,159,61
0334,Obsolete,Push Pull Grip Sht 43x51x.30 ,1093251,Push Pull Grip Sht 43x51x.30 ,0,PAL,EA,1000,1.23,1230,2
0335,Obsolete,Spread Artichoke,FP48073,Artichoke Spread 1-30 Lb,0,PL,OZ,480,0.2169,104.112,77
0336,Obsolete,Spread Dijonnaise,FP48070,Dijonnaise Spread 1-30 Lb,0,PL,OZ,480,0.2041,97.968,77
0337,Obsolete,Spread Mayo Pesto,FP48072,Mayo Pesto Spread 1-30 Lb,0,PL,OZ,480,0.1735,83.28,77
0338,Obsolete,Spread Sun Dried Tomato,FP48071,Sun Dried Tomato Sprd 1-30 Lb,0,PL,OZ,480,0.1689,81.072,77
0339,Active,Ham Honey Smkd Diced 1/4in,122745,Ham Honey Smkd Diced 1/4in,0,CS,LB,10,2.88,28.8,32
0340,Active,Pepper Green Diced 1/4in,70653104,Pepper Green Diced 1/4in,0,CS,OZ,400,0.0936,37.44,34
0340,Active,Pepper Green Diced 1/4in,16715,Pepper Green Diced 1/4in,0,CS,OZ,720,0.0936,67.392,22
0341,Active,Sausage Crumbles 2-5 Lb,Sara Lee 39001,Sausage Crumbles 2-5 Lb,0,CS,OZ,160,0.2113,33.808,42
0341,Active,Sausage Crumbles 2-5 Lb,39001,Sausage Crumbles 2-5 Lb,0,CS,OZ,160,0.2113,33.808,78
0342,Active,Spread Cream Chs Cinn Maple,8805,Spread Cream Chs Cinn Maple,0,CS,OZ,480,0.1469,70.512,9
0343,Active,Ctn Saus HEB Brkfst Panini,HEB Sausage Panini,Carton Saus HEB Brkfst Panini,0,EA,EA,1,0.142,0.142,55
0343,Active,Ctn Saus HEB Brkfst Panini,HEB Sausage Panini,Carton Saus HEB Brkfst Panini,0,EA,EA,1,0.142,0.142,17
0344,Active,Ctn Westrn HEB Brkft Panini,HEB Western Panini,Carton Westrn HEB Brkft Panini,0,EA,EA,1,0.142,0.142,17
0344,Active,Ctn Westrn HEB Brkft Panini,HEB Western Panini,Carton Westrn HEB Brkft Panini,0,EA,EA,1,0.142,0.142,55
0345,Active,Film Tiro Heb National Hot Dog,Hebrew National HD,Film Tiro Heb National Hot Dog,0,RL,IMP,15603,0.0686,1070.3658,20
0346,Obsolete,Egg CF Insert Folded Egg White,86528-CF,Dbl Folded Egg Wht Omelet CF,0,CS,EA,180,0.1944,34.992,7
0347,Active,Egg CF White Patty 1.67 oz,70062-CF,Egg CF White Patty 192-1.67 Oz,0,CS,EA,192,0.1879,36.0768,7
0348,Active,Tuna Salad w/ Albacore 45 Lb,47692-20121 (45Lb),Tuna Salad (SK Food Group),0,CS,OZ,720,0.3868,278.496,79
0349,Active,Mustard Grey Poupon 2/128 Oz,377285,Mustard Grey Poupon 2/128oz,0,CS,OZ,256,0.2509,64.2304,42
0349,Active,Mustard Grey Poupon 2/128 Oz,36359,Mustard Grey Poupon 2/128 Oz,0,CS,OZ,256,0.2509,64.2304,80
0350,Active,Roll Focaccia Panini,36301,Panini Focaccia Roll,0,CS,EA,100,0.2707,27.07,5
0351,Obsolete,Ham Blk Frst Log Unslcd Panini,4170,2-15 Lb (Catch),0,LB,LB,1,3.2,3.2,10
0352,Active,Spread Pesto No Nut ,FP48075,Nut Free Pesto 30 Lb,0,PL,OZ,480,0.1725,82.8,77
0353,Obsolete,Vinegar Balsamic,52200,Vinegar Balsamic 2-5 LT,1,CS,OZ,338,0.1327,44.8526,19
0354,Obsolete,Flatbread Grilled 6x6 3 Oz,67313,6x6 Grilled Pocket Flatbread,0,CS,EA,120,0.2142,25.704,81
0355,Active,Cheese Mozzarella 1.3 Oz,46793,18-16.5Oz Mozzarella 1.3 Oz,30,CS,EA,222,0.2238,49.6836,9
0356,Active,Cheese Swiss Sliced .75 Oz,46794,18-16.5 Oz Swiss .75 Oz,30,CS,EA,396,0.1881,74.4876,9
0357,Active,Cheese Pepper Jack .75 Oz,46795,18-1 Lb Pepper Jack .75z Intlf,30,CS,EA,396,0.1431,56.6676,9
0358,Active,Chicken Artisan Rst Slcng Log,59594,Natural Uncured Chicken Breast,0,LB,LB,1,3.98,3.98,82
0359,Active,Spread Cream Chs Green Chili,8969,Spread Cream Chs Green Chili,0,CS,OZ,480,0.1114,53.472,9
0360,Obsolete,Film SBUX Panini Tuna Salad,SBUX Panini Tuna,Film SBUX Panini Tuna Salad,0,IMP,IMP,1,0,0,83
0361,Obsolete,Film SBUX Panini Ham Swiss,SBUX Panini Ham,Film SBUX Panini Ham Swiss,0,IMP,IMP,1,0,0,83
0362,Obsolete,Film SBUX Panini Rstd Tomato,SBUX Panini Tomato,Film SBUX Panini Rstd Tomato,0,IMP,IMP,1,0,0,83
0363,Obsolete,Film SBUX Panini Santa Fe Chic,SBUX Panini Chicken,Film SBUX Panini Santa Fe Chic,0,IMP,IMP,1,0,0,83
0364,Active,Film BOPP Fuji 10 in Web,SCR-25 10 Web,10 9,No Control,9842,FT,IN,0.0006,0,60
0364,Active,Film BOPP Fuji 10 in Web,10 BOPP,Film BOPP Fuji 10 in Web,9842,FT,IN,12,0.0006,0.0072,61
0365,Active,Ham Log Cured 3.5 Inch SBUX,75143,Ham Log Cured Unsliced SBUX,0,LB,LB,1,3.11,3.11,12
0366,Obsolete,Egg Patty Ham Ched 4 Oz CF,2003-01,Ham Ched Egg Patty 4 Oz CF,0,CS,EA,72,0.92,66.24,84
0367,Obsolete,Butter French Herb .4 Oz,Formula 2116 .4 Oz,Butter French Herb .4 Oz,0,EA,EA,1,0.1076,0.1076,85
0368,Obsolete,Apple Wedge Roasted Simplot,397175,Apple RoastWorks Fuji 6-2.5Lb,0,CS,OZ,240,0.1255,30.12,42
0369,Obsolete,Squash ButtrNut IQF 3/4in Dice,VDF R95.1,Squash ButtrNut IQF 3/4in Dice,0,CS,OZ,800,0.1031,82.48,86
0370,Obsolete,Asparagus Tips IQF Roasted 1in,VDF J49,Asparagus Tips IQF Roasted 1in,0,CS,OZ,800,0.1938,155.04,86
0371,Active,Sweet Potato Medley Roasted,AX508,Oven Roasted Potato Medley,0,CS,OZ,240,0.0899,21.576,13
0372,Active,Bowl Round Anchor 12 Oz,M5816B,Bowl Round Anchor 12 Oz,0,CS,EA,500,0.0901,45.05,2
0373,Active,Lid Round Anchor 12 Oz,LH5800,Lid Round Anchor 12 Oz,0,CS,EA,500,0.1105,55.25,2
0374,Active,Lbl Saus Scramble Bowl Lid,0374 Saus Bowl Lid,Lbl Saus Scramble Bowl Lid,0,RL,EA,1000,0.0246,24.6,20
0375,Active,Lbl Bacon Scramble Bowl Lid,0375 Bacon Bowl Lid,Lbl Bacon Scramble Bowl Lid,0,RL,EA,1000,0.0246,24.6,20
0376,Active,Lbl Chckn Teriyaki Bowl Lid,0376 Chckn Bowl Lid,Lbl Chckn Teriyaki Bowl Lid,0,RL,EA,1000,0.0246,24.6,20
0377,Active,Lbl Saus Scramble Bowl Bottom,0377 Saus Bowl Btm,Lbl Saus Scramble Bowl Bottom,0,RL,EA,2000,0.0076,15.2,20
0378,Active,Lbl Bacon Scramble Bowl Bottom,0378 Bacon Bowl Btm,Lbl Bacon Scramble Bowl Bottom,0,RL,EA,2000,0.0076,15.2,20
0379,Active,Lbl Chckn Teriyaki Bowl Bottom,0379 Chckn Bowl Btm,Lbl Chckn Teriyaki Bowl Bottom,0,RL,EA,2000,0.0076,15.2,20
0380,Active,Box Master Cash n Carry 12 Pk,Spec 71352 TBD,Box Master Cash n Carry 12 Pk,0,EA,EA,1,0.408,0.408,17
0381,Active,Lbl Master C C Saus Croiss 5x7,C C Lbl Saus Croiss,Lbl Master C C Saus Croiss 5x7,0,RL,EA,850,0.1318,112.03,17
0382,Active,Lbl Master C C Saus Muffin 5x7,C C Lbl Saus Muffin,Lbl Master C C Saus Muffin 5x7,0,RL,EA,850,0.1318,112.03,17
0383,Active,Lbl Master C C Bacon Bisc 5x7,C C Lbl Bacon Bisc,Lbl Master C C Bacon Bisc 5x7,0,RL,EA,850,0.1318,112.03,17
0384,Active,Ham Log Cured 6 Inch SBUX,113202,Ham Log Cured Lunch SBUX,0,LB,LB,1,3.02,3.02,12
0385,Active,Box Master WF 6-4PK HCC,9.5x8.5x13.5 26B HCC,Box Master WF 6-4PK HCC,1,EA,EA,1,0.4699,0.4699,17
0386,Active,Tomatoes Roasted Wedges in Oil,RW1,Tomatoes Rinsed Wedges,0,CS,OZ,400,0.3681,147.24,87
0387,Active,Potato Popcorn 6-5 Lb,MCF05065,Formed Potato Popcorn Grade A,1,CS,OZ,480,0.1044,50.112,34
0388,Active,Bowl Round Sabert 5in 12 Oz,75112B500,Bowl Round Sabert 5in 12 Oz,0,CS,EA,500,0.0811,40.55,17
0389,Active,Lid Round Sabert for 0388,52571B500,Lid Round Sabert for 0388,0,CS,EA,500,0.0752,37.6,17
0390,Active,Box Master OP Scramble Bowls,72155,Box Master OP Scramble Bowls,1,EA,EA,1,0.359,0.359,17
0391,Active,Lbl OP Bcn Scramble Bowl Lid,0391 Bcn Bowl Lid,Lbl OP Bcn Scramble Bowl Lid,0,RL,EA,1000,0.0779,77.9,20
0392,Active,Lbl OP Bcn Scramble Bowl Btm,0392 Bcn Bowl Btm,Lbl OP Bcn Scramble Bowl Btm,0,RL,EA,1000,0.0198,19.8,20
0393,Active,Lbl OP Chicken Teri Bowl Lid,0393 Teri Bowl Lid,Lbl OP Chicken Teri Bowl Lid,0,RL,EA,1000,0.0779,77.9,20
0394,Active,Lbl OP Chick Teri Bowl Btm,0394 Teri Bowl Btm,Lbl OP Chick Teri Bowl Btm,0,RL,EA,1000,0.0198,19.8,20
0395,Active,Lbl OP Ham Scramble Bowl Lid,0395 Ham Bowl Lid,Lbl OP Ham Scramble Bowl Lid,0,RL,EA,1000,0.0779,77.9,20
0396,Active,Lbl OP Ham Scramble Bowl Btm,0396 Ham Bowl Btm,Lbl OP Ham Scramble Bowl Btm,0,RL,EA,1000,0.0198,19.8,20
0397,Active,Lbl OP Saus Scramble Bowl Lid,0395 Saus Bowl Lid,Lbl OP Saus Scramble Bowl Lid,0,RL,EA,1000,0.0779,77.9,20
0398,Active,Lbl OP Saus Scramble Bowl Btm,0398 Saus Bowl Btm,Lbl OP Saus Scramble Bowl Btm,0,RL,EA,1000,0.0198,19.8,20
0399,Active,Biscuit Buttermilk 2 Oz Sliced,849,Biscuit Buttermilk 2 Oz Sliced,1,CS,EA,144,0.1161,16.7184,41
0400,Active,Roll White Rustic 190/Cs,17117,Roll White Rustic SBUX 190/Cs,1,CS,EA,190,0.1994,37.886,5
0401,Active,Film BOPP Fuji 16 in Web,SCR-25 16 Web,Film BOPP Fuji 16 in Web,9842,FT,IN,12,0.0009,0.0108,60
0402,Active,Ctn PrcChop BECB 4 Pk Zipper,Price Chopper BECB,Ctn PrcChop BECB 4 Pk Zipper,0,EA,EA,1,0.1306,0.1306,55
0403,Active,Ctn PrcChop SECB 4 Pk Zipper,Price Chopper SECB,Ctn PrcChop SECB 4 Pk Zipper,0,EA,EA,1,0.1306,0.1306,55
0404,Active,Ctn PrcChop SECC 4 Pk Zipper,Price Chopper SECC,Ctn PrcChop SECC 4 Pk Zipper,0,EA,EA,1,0.1306,0.1306,55
0405,Active,Ctn PrcChop Panini Chick Club,PChop Panini Chk Clb,Ctn PrcChop Panini Chick Club,0,EA,EA,1,0.1002,0.1002,55
0406,Active,Ctn PrcChop Panini Chik Philly,PChop Pan Chk Phly,Ctn PrcChop Panini Chik Philly,0,EA,EA,1,0.1002,0.1002,55
0407,Active,Ctn PrcChop Panini Chik Spin,PChop Pan Chk Spin,Ctn PrcChop Panini Chik Spin,0,EA,EA,1,0.1002,0.1002,55
0408,Active,Ctn PrcChop Panini Philly Stk,PChop Pan Philly Stk,Ctn PrcChop Panini Philly Stk,0,EA,EA,1,0.1002,0.1002,55
0409,Active,Ctn PrcChop Bowl BEC 8 Oz,PChop Bowl BEC 8z,Cth PrcChop Bowl BEC 8 Oz,0,EA,EA,1,0.1396,0.1396,55
0411,Active,Ctn PrcChop Bowl HECP 8 Oz,PChop Bowl HECP 8z,Ctn PrcChop Bowl HECP 8 Oz,0,EA,EA,1,0.1396,0.1396,55
0412,Active,Ctn PrcChop Bowl CECP 8 Oz,PChop Bowl SECP 8z,Ctn PrcChop Bowl CECP 8 Oz,0,EA,EA,1,0.1396,0.1396,55
0413,Active,Film Fuji SECM Direct Plus,Direct Plus SECM,Film Fuji SECM Direct Plus,0,RL,EA,15000,0.0694,1041,20
0414,Active,Film Fuji CBECM Direct Plus,Direct Plus CBECM,Film Fuji CBECM Direct Plus,0,RL,EA,15000,0.0694,1041,20
0415,Active,Ctn 2x2PK BacEggChsBisc Meijer,Meijer BECB 2x2Pk,Ctn 2x2PK BacEggChsBisc Meijer,0,EA,EA,1,0.1109,0.1109,55
0416,Active,Ctn 2x2PK SauEggChsCroi Meijer,Meijer SECC 2x2Pk,Ctn 2x2PK SauEggChsCroi Meijer,0,EA,EA,1,0.1109,0.1109,55
0417,Active,Ctn 2x2PK SauEggChsMuff Meijer,Meijer SECM 2x2Pk,Ctn 2x2PK SauEggChsMuff Meijer,0,EA,EA,1,0.1109,0.1109,55
0418,Active,Ctn 2x2PK SauEggChsBisc Meijer,Meijer SECB 2x2Pk,Ctn 2x2PK SauEggChsBisc Meijer,0,EA,EA,1,0.1407,0.1407,55
0419,Active,Sausage Italian Chick Crumble,B20-CC3459,Ckd Ital Chicken Pty Crumble,0,CS,LB,30,2.67,80.1,66
0420,Active,Pepper Bell Yellow Rstd IQF,16719 - 45Lbs,Bell Pepper Yellow Rst 1/4Unchangeable Control,CS,OZ,720,CS,0.1061,0,22
0420,Active,Pepper Bell Yellow Rstd IQF,PYR-DICE-0045,Pepper Bell Yellow Rstd IQF,0,CS,OZ,720,0.1061,76.392,40
0420,Active,Pepper Bell Yellow Rstd IQF,Rework-40 Lb,Pepper Yellow CM Rstd 3/8No Control,CS,OZ,640,,0.1061,0,88
0421,Active,Spread Cream Chz Rst Red Ppr,9793,Spread Cream Chz Rst Red Ppr,1,CS,OZ,480,0.1181,56.688,9
0422,Active,Egg CF LS Insrt Fold Egg White,86528 LS,Egg CF LS Insrt Fold Egg White,0,CS,EA,180,0.2044,36.792,7
0423,Active,Zucchini Diced Rstd IQF,507143,Zucchini Diced Rstd IQF,0,CS,OZ,640,0.1256,80.384,88
0424,Active,Film SBUX 9.5in ChickSaus Wrap,SKCSW95,Film SBUX 9.5in ChickSaus Wrap,0,RL,IMP,12500,0.0078,97.5,61
0426,Active,Spread Cream Cheese Fig,9858,Spread Cream Cheese Fig,0,CS,OZ,480,0.1513,72.624,9
0427,Active,Egg LS Patty Scrambled 1.67 oz,70061 LS,Egg LS Patty Scrambled 1.67 OZ,0,CS,EA,168,0.1245,20.916,7
0428,Active,Chicken Seas Ckd Strips,B20-CC2067,Chicken Seas Ckd Strips,0,CS,LB,30,3.2,96,66
0429,Active,Flatbread Flax Rollup Perf,P-5340907-0612,Flatbread Flax Rollup 7x9 Perf,1,CS,EA,72,0.2877,20.7144,39
0430,Active,Flatbread Garden Rollup Perf,P-5780907-0612,Flatbread Garden Rollup Perf,1,CS,EA,72,0.2877,20.7144,39
0431,Active,Turkey Breast Uncured Smoked,59570,Turkey Breast Uncured Smoked,0,LB,LB,1,4.39,4.39,82
0432,Active,Onion Sliced Balsamico,60911,Onion Sliced Balsamico,0,CS,OZ,528.6,0.1153,60.94758,89
0433,Active,Egg LS Patty Frittata Cheese,85429 LS,Egg LS Patty Frittata Cheese,0,CS,EA,200,0.2384,47.68,7
0434,Active,Egg LS Frittata Chs Veg 1.75Z,85428 LS,Egg LS Frittata Chs Veg 1.75Z,0,CS,EA,200,0.2511,50.22,7
0435,Active,Tray Clear Hinged DV3708,1147859,Tray Clear Hinged DV3708,0,CS,EA,250,0.23,57.5,2
0436,Active,Thai Sweet Chili Sauce,13006P0069,Thai Sweet Chili Sauce,0,CS,OZ,468,0.0744,34.8192,90
0437,Active,Bamboo Shoot Strips,42220,Bamboo Shoot Strips,0,CS,OZ,618,0.0671,41.4678,91
0438,Active,Carrot Strips Julienne,43602,Carrot Strips Julienne,0,CS,OZ,528,0.0593,31.3104,91
0439,Active,Cheese Mont Jack Slcd .67 Oz,141,Cheese Mont Jack Slcd .67 Oz,0,CS,EA,648,0.1187,76.9176,9
0440,Active,Dairy Base Bulk,9531,Dairy Base Bulk,0,CS,OZ,480,0.105,50.4,9
0441,Active,Loaf Pullman Cinnamon Raisin,2372,Loaf Pullman Cinnamon Raisin,0,CS,EA,280,0.1099,30.772,28
0442,Active,Apple IQF Diced 3/8TRETOP,Apple IQF Diced 3/8No Control,0,OZ,640,,0,0,0,1000
0442,Active,Apple IQF Diced 3/8PETFAR,Apple IQF Diced 3/8No Control,0,OZ,640,,0,0,0,1000
0443,Active,Cheese Brie Sliced .705 Oz,57200,Cheese Brie Sliced .705 Oz,0,CS,EA,150,0.3102,46.53,92
0444,Obsolete,Cheese Pepperjack Slcd .75 Oz,127134,Cheese Pepperjack Slcd .75 Oz,0,CS,EA,512,0.1706,87.3472,49
0445,Active,Spread Hummus,351000O1,Spread Hummus 36 Lb,0,CS,OZ,576,0.1152,66.3552,93
0446,Active,Lbl CWrap Jamba Hummus 500/Rl,Wrap Jamba Hummus,Lbl C-Wrap Jamba Hummus,0,RL,EA,500,0.029,14.5,94
0447,Active,Lbl CWrap Jamba TrkyJck 500/Rl,Wrap Jamba Trky,Lbl C-Wrap Jamba Turkey Jack,0,RL,EA,500,0.029,14.5,94
0448,Active,Lbl CWrp Jamba ThaiChkn 500/Rl,Wrap Jamba Thai,Lbl C-Wrap Jamba Thai Chicken,0,RL,EA,500,0.029,14.5,94
0449,Active,Shrink Band Anchor Bowl,Shrink Band,Shrink Band Anchor Bowl,0,CS,EA,4000,0.0162,64.8,2
0450,Active,Sauce Orange 12-2 Lb,34516,Sauce Orange 12-2 Lb,0,CS,OZ,384,0.1028,39.4752,95
0451,Active,Rice Veg Fried 12-2 Lb,29904,Rice Veg Fried 12-2 Lb,0,CS,OZ,384,0.128,49.152,95
0452,Active,Rice Jasmine Brown 12-2 Lb,29908,Rice Jasmine Brown 12-2 Lb,0,CS,OZ,384,0.134,51.456,95
0453,Active,Tortilla Corn White 4.5 Inch,53017-10104,Tortilla Corn White 4.5 Inch,0,CS,EA,768,0.0273,20.9664,75
0454,Active,Film BOPP Fuji 13.5 In Web,13.5In Web 10M Ft/Rl,Film BOPP Fuji 13.5 In Web,0,FT,IN,12,0.0007,0.0084,61
0454,Active,Film BOPP Fuji 13.5 In Web,SCR-25 13.5 BOPP,13.5 9,No Control,9842,FT,IN,0.0007,0,60
0455,Active,Sauce Enchilada La Vic 6/#10,4274833,Sauce Enchilada La Vic 6/#10,0,CS,OZ,612,0.06,36.72,1
0456,Active,Chicken Bnls Wing Sesame Brd,25243,Chicken Bnls Wing Sesame Brd,0,CS,LB,30,2.98,89.4,6
0457,Active,Square White Blank 3 x 3,CRALAB 0457,Square White Blank 3 x 3,0,CS,EA,11700,0.0076,88.92,94
0457,Active,Square White Blank 3 x 3,B2069358100-003,Square White Blank 3 x 3,0,CS,EA,13500,0.0076,102.6,25
0458,Active,Lbl 3x3 Jamba Bistro Panini 1M,3x3 Jamba Bistro,Lbl 3x3 Jamba Bistro Panini,0,RL,EA,1000,0.025,25,94
0459,Active,Lbl 3x5 Jamba Bistro Nutrtn 1M,3x5 Bistro Nutrition,Lbl 3x5 Jamba Bistro Nutrition,0,RL,EA,1000,0.0225,22.5,94
0460,Active,Beef Patty Angus 4.0 OZ,320104,FC Seas Angus Bf Patty 4 Oz,0,CS,EA,160,0.9775,156.4,71
0461,Active,Lbl Cmbrlnd Burger Top,10010008204,Lbl Cmbrlnd Burger Top,0,RL,EA,2000,0.0264,52.8,96
0462,Active,Lbl Cmbrlnd Chs Burger Top,10010008205,Lbl Cmbrlnd Chs Burger Top,0,RL,EA,2000,0.0264,52.8,96
0463,Active,Lbl Cmbrlnd Bcn Chs Burger Top,10010008206,Lbl Cmbrlnd Bcn Chs Burger Top,0,RL,EA,2000,0.0264,52.8,96
0464,Active,Lbl Cmbrlnd Burger Bottom,10010008201,Lbl Cmbrlnd Burger Bottom,0,RL,EA,2000,0.0092,18.4,96
