number,status,sk_description,supplier_number,supplier_description,minimum_po_quantity,purchase_unit,stock_unit,pur_stk_conversion,price_per_stock_unit,price_per_purchase_unit,supplier_id
0001,Active,Sauce BBQ Smoky Cattlemens,,Sauce BBQ Smokey 4-1gl,0,CS,OZ,512,0.0879,45.0048,1
0002,Active,Bailing Wire 12 ga 14,898292,Bailing Wire 12 gauge 14ft,0,BD,EA,125,0,0,2
0003,Active,Blue Ice  Nordic 24oz - 24/Cs,389651,Blue Ice Nordic 24ct,0,CS,EA,24,0,0,2
0004,Active,Tiro Black Ink Fast Dry 48/Cs,IC5033,Tiro Black Ink Fast Dry 48/Cs,0,CS,EA,48,0,0,3
0005,Active,Tiro Character/Number Kit 4ea,TP0130,Tiro Character/Number Kit 4ea,0,BOX,EA,4,0,0,3
0006,Active,Pallet Covers 1 Mill 250/Roll,S-13538,Palette Covers 1 Mill 250/Roll,0,RL,EA,250,0,0,4
0007,Obsolete,Roll Wheat Rustic 130/Cs,26292,Roll Wheat Rustic SBUX,40,CS,EA,130,0.256,33.28,5
0008,Obsolete,Roll White Rustic 130/Cs,26291,Roll White Rustic SBUX,40,CS,EA,130,0.246,31.98,5
0009,Active,Chicken Bnls Wing Breaded,7206,Cntry Style Brst Meat Bnls Wng,0,CS,LB,10,2.41,24.1,6
0010,Obsolete,Egg Patty Frittata Cheese,85429,200-1.75 Oz,0,CS,EA,200,0.2328,46.56,7
0012,Obsolete,Bacon Uncured Slcd 2-150 EA,12604,Bacon Uncured Slcd 2-150 EA,120,CS,EA,300,0.1309,39.27,8
0013,Active,Cheese Cheddar Mild .5oz Slice,33609,8-2 Lb,42,CS,EA,512,0.0814,41.6768,9
0014,Active,Cheese Gouda .5oz Slice,33610,8-2 Lb,0,CS,EA,512,0.0864,44.2368,9
0015,Obsolete,Ham Blk Forest Log Unsliced,4147,4-6 Lb (Catch),1200,LB,LB,1,3.75,3.75,10
0016,Obsolete,Cheese Pepper Jack .5 OZ,60270,8/1.25 Lb,120,CS,EA,320,0.1182,37.824,11
0017,Active,Sausage Patty Pork 1.5 oz Nat,18809,Sausage Patty Pork 1.5 oz Nat,0,CS,EA,426,0.17,72.42,12
0018,Obsolete,Tomato Roma Roasted Diced ,7149602,40 Lb,42,CS,OZ,640,0.1063,68.032,13
0019,Obsolete,Film Polypro Fuji 12 in Web,RKHS010012000500,12 IN 10139 FT/RL  36 RL/PLT,365004,FT,IN,12,0.0006,0.0072,14
0020,Obsolete,Beef Hamburger Patty 2.6oz,United 2.6z Bf Patty,Fully Ckd Beef Patty 2.6z,1,CS,EA,247,0.393,97.071,15
0020,Obsolete,Beef Hamburger Patty 2.6oz,1100XSX,Beef Hamburger Patty 2.6 Oz,64,CS,EA,93,0.393,36.549,16
0021,Obsolete,Box #8 40PK Artisan Plain,10469070,Box #8 40PK Artisan Plain,1,EA,EA,1,0.36,0.36,17
0022,Obsolete,Box #9 12-16 PK Artisan/Muffin,TBD 12-16 PK SBUX,TBD 12-16 PK SBUX,1,EA,EA,1,0.2789,0.2789,17
0023,Obsolete,Box 60 PK Saus Muf Kraft Plain,TBD 60PK Sausage,TBD 60 PK Sausage SBUX,1,EA,EA,1,0,0,17
0024,Obsolete,Film Polypro Fuji 9.5 In Web,Co-Ex OPP 9.5.001 Co-Ex OPP 9.5x10139,No Control,FT,IN,12,,0.0005,0,18
0024,Obsolete,Film Polypro Fuji 9.5 In Web,RKHS010009500500,9.5 IN 10139 FT/RL 45/PAL,456255,FT,IN,12,0.0005,0.006,14
0025,Obsolete,Chutney Mango 4 Lb Sukhis,87502,Chutney Mango 4 Lb Sukhis,1,TB,OZ,64,0.279,17.856,19
0026,Obsolete,Film Lidding Z12 EZ Peel,ESXE1250Z12,Film Lidding Z12 EZ Peel,0,RL,IN,36000,0.0084,302.4,14
0026,Obsolete,Film Lidding Z12 EZ Peel,0026 Film Lidding,Film Lidding 3M Ft/Roll 420 mm,0,RL,IN,36000,0.0084,302.4,20
0027,Obsolete,Cheese Mont Jack Sliced .5 Oz,33611,8-2Lb 64 SL Mont Jack .5 Oz,42,CS,EA,512,0.0853,43.6736,9
0028,Obsolete,Film Polypro Fuji 14.5 in Web,RKHS010014500500,Film Polypro Fuji 14.5 in Web,273753,FT,IN,12,0.0008,0.0096,14
0029,Obsolete,Film Fuji Spec Value Hamburger,0029 Special Value,Film Fuji Spec Value Hamburger,1,RL,IMP,12500,0.0427,533.75,20
0030,Obsolete,Film Fuji Spec Value Saus Chs,0030 Special Value,Film Fuji Spec Value Saus Chs,1,RL,IMP,13333,0.0382,509.3206,20
0031,Obsolete,Bacon Turkey Half Slce Natural,871206,Bacon Turkey Half Slce Natural,1,LB,LB,1,10.69,10.69,21
0032,Obsolete,Egg White Patty 1.75 oz,86529,Egg White Patty 184-1.75 Oz,108,CS,EA,184,0.1393,25.6312,7
0033,Obsolete,Cheese Mild Red Fat Ched Slcd,34038,Cheese Mild Red Fat Ched Slcd,42,CS,EA,384,0.1129,43.3536,9
0034,Obsolete,Egg Insert Folded Egg White,76500,Double Folded Egg White Omelet,0,CS,EA,180,0.1489,26.802,7
0035,Active,Tomato Rstd Diced Rdcd Moist ,16865,BL Tomato 40 Lb SCC,1,CS,OZ,640,0.2999,191.936,22
0036,Obsolete,Box Master Spec Val Hamburger,218205,Special Value Hamburger,1,EA,EA,1,0.3565,0.3565,17
0037,Obsolete,Box Master Spec Val Saus Chs,218206,Special Value Saus Chs,1,EA,EA,1,0.3012,0.3012,17
0039,Active,Pork Rib BBQ With Sauce,774X,Pork Rib BBQ With Sc 64/Cs,0,CS,EA,64,0.5523,35.3472,16
0040,Active,Cheese American Processed .40z,Chateaux 5007,American Rstrctd Melt 4-5 Lb,100,CS,EA,800,0.0436,34.88,23
0040,Active,Cheese American Processed .40z,5007 Chateaux,Cheese American Processed .40z,0,CS,EA,800,0.0436,34.88,24
0041,Obsolete,Box Master Kaiser 36 Ct,Spec 72765,Box Master Kaiser 36 Ct,7800,EA,EA,1,0.4443,0.4443,17
0042,Obsolete,Carton 1PK Turkey Kaiser,Turk 2009-0381-0429,Carton 1PK Turkey Kaiser,20000,EA,EA,1,0.0884,0.0884,17
0043,Obsolete,Carton 1PK Ham/Chs Kaiser, Ham 2009-0381-0429,Carton 1PK Ham/Chs Kaiser,20000,EA,EA,1,0.0884,0.0884,17
0044,Obsolete,Carton 1PK Hamburger,Burgr 2009-0381-0429,Carton 1PK Hamburger,20000,EA,EA,1,0.0884,0.0884,17
0045,Active,Film Tiro OP Ham Wedge Lidding,6221 Oven Pride,Film Tiro OP Ham Wedge Lidding,1,RL,EA,21532,0.0385,828.982,20
0046,Active,Film Tiro OP Turky Wdg Lidding,6220 Oven Pride,Film Tiro OP Turk Wdg Lidding,1,RL,EA,21532,0.0385,828.982,20
0047,Obsolete,Lbl Direct Therml 1-3/8x1-1/16,DT10013 1-3/8x1-1/16,1-3/8x1-1/16 Direct Thermal,1,RL,EA,8000,0,0,25
0048,Active,Glue Cartoning PHC9254,HB Fuller PHC9254,Glue Cartoning PHC9254,22,CS,LB,31,0,0,26
0049,Obsolete,Roll White Rustic 160/Cs,36296,Roll White Rustic SBUX 160/Cs,40,CS,EA,160,0.2395,38.32,5
0050,Obsolete,Ribbon Black VideoJet iimak,25TT4BK15VJI,Ribbon Black Videojet iimak,1,CS,FT,35433,0.0129,457.0857,14
0051,Obsolete,Ribbon Blue VideoJet iimak,25TT4BL15VJI,Ribbon Blue Videojet iimak,1,CS,FT,35433,0.0247,875.1951,14
0052,Obsolete,Ribbon Green VideoJet iimak,25TT4GR15VJI,Ribbon Green Videojet iimak,1,CS,FT,35433,0.0247,875.1951,14
0053,Obsolete,Ribbon Orange VideoJet iimak,25TT4OR15VJI,Ribbon Orange Videojet iimak,1,CS,FT,35433,0.0247,875.1951,14
0054,Obsolete,Ribbon Red VideoJet iimak,25TT4RD15VJI,Ribbon Red Videojet iimak,1,CS,FT,35433,0.0247,875.1951,14
0055,In Development,Beef Hamburger Patty 1 Oz,102,Old Fashioned Mini Bf Patties,1,CS,EA,240,0.2106,50.544,16
0056,Active,Chicken Breast Bnls Ckd 4 Oz,702708,Chicken Breast Bnls Ckd 4 Oz,0,CS,EA,120,0.8925,107.1,27
0057,Active,Bun Kaiser WW 6-12 Pk,5015 SK,Bun Kaiser WW 6-12 Pk,0,CS,EA,72,0.16,11.52,28
0058,Active,Baguette Big Hole 32/Cs,80302855,French HD Baguette Big Hole,1,CS,EA,32,0.3672,11.7504,29
0060,Obsolete,Film Lidding Z14 EZ Peel,ESXE1270Z14,Film Lidding Z-14 E-Z Peel,90,RL,IN,35984,0.0086,309.4624,14
0061,Active,Box Master #1 Kraft Plain,1.02189E+11,Box #1 Kraft Plain 1050/Plt,0,EA,EA,1,0.326,0.326,17
0062,Active,Susceptor Sleeve Baguetta,8480V1,SBS/Adhesive/48 Gauge MPET,10000,EA,EA,1,0.0871,0.0871,30
0063,Obsolete,Insert RF Cheese Egg Bacon IQF,4610033532,IQF RF Cheese Egg Bacon Sticks,1,EA,EA,1,0.5794,0.5794,31
0064,Active,Film Fuji PP Cheeseburger,C100064 OP,Film Fuji P/P Cheeseburger,100,LB,IN,1689.600912,0.0035,5.913603192,20
0065,Obsolete,Insert Cheeseburger IQF,4610033533,IQF Cheeseburger Stick,1,EA,EA,1,0.6267,0.6267,31
0066,Obsolete,Insert Polish Saus Smkd Sknls,114918,Polish Sausage Skinless 5-1,1,CS,EA,50,0.39,19.5,32
0067,Not Stocked,Ribbon Black Wax 4x1181,JETWAX400,Ribbon Black Wax 4x1181,1,CS,RL,24,16.15,387.6,25
0068,Obsolete,Roll White Rustic 180/Cs,36300,Roll White Rustic SBUX 180/Cs,1,CS,EA,180,0.1919,34.542,5
0069,Active,Film Fuji Polish Baguetta,69,Film Fuji Polish Baguetta,1,IMP,IMP,1,0.0426,0.0426,20
0070,Active,Film Fuji Bacon Chs Baguetta,70,Film Fuji Bacon Chs Baguetta,1,IMP,IMP,1,0.0426,0.0426,20
0071,Active,Film Fuji Cheesy Beef Baguetta,71,Film Fuji Chsburger Baguetta,1,IMP,IMP,1,0.0426,0.0426,20
0072,Obsolete,Box Master Baguetta 24 Pk,Baguetta Master,Box Master Baguetta 24 Pk,1,EA,EA,1,0.4223,0.4223,17
0073,Active,Cheese RF Mild Chdr Orng .5 Oz,34105,RF Mild Ched C .5z Rpd Pk,42,CS,EA,512,0.1018,52.1216,9
0074,Active,Cheese RF Mild Chdr Wht .5 Oz,34106,RF Mild Ched W .5z Rpd Pk,42,CS,EA,512,0.0932,47.7184,9
0075,Obsolete,Egg Frittata Patty 2 Oz,85430,Egg Frittata Patty 2 oz,70,CS,EA,140,0.3363,47.082,7
0076,Active,Sausage Patty Turkey 1.5 Oz,71105 Ember,Sausage Patty Turkey 1.5 Oz,1,CS,EA,106,0.2038,21.6028,33
0077,Active,Sausage Pork Link .5 Oz,160063,FC Pork Sausage Link Sknls .5z,1,CS,EA,320,0.0583,18.656,32
0078,Active,Potato Diced Brkfst Cube,MCS302,Diced Hashbrowns Potato Grd A,1,CS,OZ,480,0.0482,23.136,34
0079,Active,Egg Curds IQF Large Cut,MF 3015,Egg Curd Frozen IQF Scrambled,1,CS,OZ,320,0.0756,24.192,35
0080,Active,Bacon Topping Preckd 1/2 Inch,12003,1/2x1/2 Preckd Bacon Topping,1,CS,OZ,160,0.283,45.28,8
0081,Active,Pancake Maple Krusteaz 240Ct,80327,240Ct Krusteaz Maple Pancakes,1,CS,EA,240,0.1659,39.816,36
0082,Active,Cheese Ched Shred Red Sodium,Chateaux 2223,Red Sodium Cheddar Shred,1,LB,OZ,16,0.1495,2.392,23
0082,Active,Cheese Ched Shred Red Sodium,Chateaux 2223,Cheese Ched Shred Red Sodium,0,LB,OZ,16,0.1495,2.392,24
0083,Obsolete,Film Map Pillow 9 Mil,3MB225M,Film Map Pillow 9 Mil,1,RL,IN,14410,0.0166,239.206,14
0084,Active,Tray Entree Black CPET 16 Oz,10165090,GPC-5066-16 Tray 16z Blk CPET,1,CS,EA,600,0.1192,71.52,17
0085,Active,Ctn Entree Saus Pancake,10492607,Carton Pancake Sausage,1,EA,EA,1,0.119,0.119,17
0086,Active,Ctn Entree Saus Eggs Potato,10492604,Carton Sausage Scramble,1,EA,EA,1,0.119,0.119,17
0087,Active,Ctn Entree Bacon Eggs Pot,10492605,Carton Bacon Scramble,1,EA,EA,1,0.119,0.119,17
0088,Active,Box Master Brkfst Entree 18Pk,10492621,Box Master Brkfst Entree 18Pk,1,EA,EA,1,0.3261,0.3261,17
0089,Obsolete,Tomato Green Mix Blend IQF,16874,Tomato Green Mix Blend IQF,1,CS,OZ,540.8,0.2841,153.64128,22
0090,Active,Box Master SBUX Muffin/Wrap,SBUX Muffin/Wrap,Box Master SBUX Muffin/Wrap,0,EA,EA,1,0.294,0.294,37
0090,Active,Box Master SBUX Muffin/Wrap,1182174,Box Master SBUX Muffin/Wrap,1,EA,EA,1,0.294,0.294,38
0090,Active,Box Master SBUX Muffin/Wrap,10551401,Box Master SBUX Muffin/Wrap,0,EA,EA,1,0.294,0.294,17
0091,Active,Box Master SBUX Artisan,1183825,Box Master SBUX Artisan,1,EA,EA,1,0.279,0.279,38
0091,Active,Box Master SBUX Artisan,10551399,Box Master SBUX Artisan,0,EA,EA,1,0.279,0.279,17
0091,Active,Box Master SBUX Artisan,SBUX Artisan,Box Master SBUX Artisan,0,EA,EA,1,0.279,0.279,37
0092,Obsolete,Egg Dbl Folded Scrmbld 1.5 Oz,86530,Egg Dbl Folded Scrmbld 1.5 Oz,1,CS,EA,200,0.1409,28.18,7
0093,Active,Flat Whole Wht Wrap Red Sodium,5400709-0612,Flat Whole Wht Wrap Red Sodium,1,CS,EA,72,0.2023,14.5656,39
0094,Obsolete,Beans Black IQF,BLB-BLCK-0020,IQF Black Beans,1,CS,OZ,720,0.06,43.2,40
0095,Obsolete,Cheese Shred Ched/PepJk,54228,Chs Fthr Shred Ched/PepJk,1,CS,OZ,320,0.1242,39.744,9
0096,Obsolete,Biscuit Cinnamon .9 Oz,898,.9 Oz Sthrn Style Cinn Biscuit,1,CS,EA,240,0.0675,16.2,41
0097,Active,French Toast 1 Oz,MF8008,Texas Style French Toast,1,CS,EA,192,0.0819,15.7248,35
0098,Active,Pancakes Mini Dippers,MF7104,Pancakes Mini .4 Oz,1,CS,EA,480,0.0318,15.264,35
0099,Obsolete,Syrup Cup 1 Oz Dipper,472104,Syrup Cup 1 Oz Dipper,0,CS,EA,200,0.12,24,42
0099,Obsolete,Syrup Cup 1 Oz Dipper,J97120,Mrs Butterworths Syrup Cup 1z,1,CS,EA,200,0.12,24,43
0100,Obsolete,Icing Cup Dippers 1Oz,9011301,Icing Cup Dippers 1Oz,1,CS,EA,200,0.16,32,44
0101,Active,Waffles Homestyle Minis 1 Oz,17514,EGGO Homestyle Minis 1 Oz,1,CS,EA,120,0.0904,10.848,45
0102,Active,Ctn Dipper Cinnamon Biscuit,10492613,Carton Dipper Cinnamon Biscuit,1,EA,EA,1,0.0778,0.0778,17
0103,Obsolete,Carton Dipper French Toast,Dipper02,Carton Dipper French Toast,1,EA,EA,1,0.0778,0.0778,17
0104,Obsolete,Carton Dipper Mini Pancakes,Dipper03,Carton Dipper Mini Pancakes,1,EA,EA,1,0.0778,0.0778,17
0106,Active,Ctn Dipper Mini Waffles,Dipper04,Carton Dipper Mini Waffles,1,EA,EA,1,0.0778,0.0778,17
0107,Active,Film Map Rigid 14 Mil,PVCEVE 30050 R,Film Map Rigid 14 Mil,1,RL,IN,5984,0.042,251.328,14
0108,Active,Lbl OP 3-5/8x3 ,P2069358100 040,Label OP 3-5/8x3,0,CS,EA,8000,0.0245,196,25
0110,Obsolete,Egg Frittata Round Patty 2 oz,85066,Egg Frittata Round Patty 2 oz,70,CS,EA,140,0.335,46.9,7
0112,Obsolete,Egg Perfecta Patty,MF4008M,Egg Perfecta Patty 160 Ea,0,CS,EA,160,0.1528,24.448,35
0113,Active,Film Tiro OP Ham Chs TriWdg,0113 OP H C Tri Wdg,Film Tiro OP Ham Chs TriWdg,0,RL,EA,15603,0.0437,681.8511,20
0114,Active,Film Tiro OP Egg Salad TriWdg,0114 OP Egg Tri Wdg,Film Tiro OP Egg Salad TriWdg,0,RL,EA,15603,0.0437,681.8511,20
0115,Active,Film Tiro OP Chix Sal TriWdg,OP Chix Tri Wdg,Film Tiro OP Chix Sal TriWdg,0,RL,EA,15603,0.0437,681.8511,20
0116,Active,Film Tiro OP Tuna Sal TriWdg,OP Tuna Tri Wdg,Film Tiro OP Tuna Sal TriWdg,0,RL,EA,15603,0.0437,681.8511,20
0117,Active,Film Tiro OP Trky Chs TriWdg,OP Trky Chs Tri Wdg,Film Tiro OP Trky Chs TriWdg,0,RL,EA,15603,0.0437,681.8511,20
0118,Active,Film Tiro OP Ham Chs DblWdg,0118 OP H C Dbl Wdg,Film Tiro OP Ham Chs DblWdg,0,RL,EA,15603,0.0437,681.8511,20
0119,Active,Film Tiro OP Egg Salad DblWdg,0119 OP ES Dbl Wdg,Film Tiro OP Egg Salad DblWdg,0,RL,EA,15603,0.0437,681.8511,20
0120,Active,Film Tiro OP Tuna Salad DblWdg,0120 OP TS Dbl Wdg,Film Tiro OP Tuna Salad DblWdg,0,RL,EA,15603,0.0437,681.8511,20
0121,Active,Film Tiro OP Chix Salad DblWdg,0121 OP CS Dbl Wdg,Film Tiro OP Chix Salad DblWdg,0,RL,EA,15603,0.0437,681.8511,20
0122,Active,Film Tiro OP Ham Tky Sw DblWdg,0122 OP HTSw Dbl Wdg,Film Tiro OP Ham Tky Sw DblWdg,0,RL,EA,15603,0.0437,681.8511,20
0123,Active,Film Tiro OP Trky Chs DblWdg,0123 OP TChs Dbl Wdg,Film Tiro OP Trky Chs DblWdg,0,RL,EA,15603,0.0437,681.8511,20
0124,Active,Film Tiro OP Trky Chs Hoagie,0124 OP TC Hoagie,Film Tiro OP Trky Chs Hoagie,0,RL,EA,15603,0.0437,681.8511,20
0125,Active,Film Tiro OP Ham Trky Hoagie,0125 OP H T Hoagie,Film Tiro OP Ham Trky Hoagie,0,RL,EA,15603,0.0437,681.8511,20
0126,Active,Film Tiro OP Ham Cheese Hoagie,0126 OP H C Hoagie,Film Tiro OP Ham Chs Hoagie,0,RL,EA,15603,0.0437,681.8511,20
0127,Active,Film Tiro KS OP Turkey Cheese,0127 OP KS Trky Chs,Film Tiro KS OP Turkey Cheese,0,RL,EA,10766,0.068,732.088,20
0128,Active,Film Tiro KS OP Ham Cheese,0128 OP KS Ham Chs,Film Tiro KS OP Ham Cheese,0,RL,EA,10766,0.068,732.088,20
0129,Active,Film Tiro KS OP Italian,0129 OP KS Italian,Film Tiro KS OP Italian,0,RL,EA,10766,0.068,732.088,20
0130,Active,Sausage Patty Pork 1.2 Oz,18804,Sausage Patty Pork 1.2 Oz,1,CS,EA,133,0.1579,21.0007,12
0131,Active,Egg Patty Scrambled 3in 1Oz,70022,Egg Patty Scrambled 3in 1Oz,1,CS,EA,360,0.0889,32.004,7
0132,Obsolete,Biscuit Buttermilk 2 Oz Sliced,3219,Biscuit Buttermilk 2 Oz Sliced,1,CS,EA,120,0.1234,14.808,41
0133,Active,Ctn 4 Pk WF Sausage Biscuit,10495876,Carton 4 Pk WF Sausage Biscuit,1,EA,EA,1,0.178,0.178,17
0134,Active,Ctn 4 Pk WF Bacon Biscuit,10495874,Carton 4 Pk WF Bacon Biscuit,1,EA,EA,1,0.178,0.178,17
0135,Active,Ctn 4 Pk WF CanBac Muffin,10495875,Carton 4 Pk WF CanBac Muffin,1,EA,EA,1,0.178,0.178,17
0136,Active,Ctn 4 Pk WF Sausage Muffin,10495873,Carton 4 Pk WF Sausage Muffin,1,EA,EA,1,0.178,0.178,17
0137,Active,Bacon Round Fully Cooked,36158,Fast N Easy Round Bacon,1,CS,EA,288,0.14,40.32,46
0137,Active,Bacon Round Fully Cooked,1252766,Bacon Rnd Fully Ckd Hormel,1,CS,EA,288,0.14,40.32,1
0138,Active,English Muffin 2 Oz Sliced,7777,English Muffin Plain Slice 2Oz,1,CS,EA,144,0.1182,17.0208,47
0139,Active,Bacon Canadian Log 4/Cs,400112,Fully Cooked Canadian Bacon WA,0,LB,LB,1,3.73,3.73,48
0140,Active,Box Master WF Saus Bisc 4-12Pk,10495885,Box Master WF Saus Bisc 4-12Pk,1,EA,EA,1,0.561,0.561,17
0141,Active,Box Master WF Bacn Bisc 4-12Pk,10495882,Box Master WF Bacn Bisc 4-12Pk,1,EA,EA,1,0.561,0.561,17
0142,Active,Box Master WF CnBac Muf 4-12Pk,10495884,Box Master WF CnBac Muf 4-12Pk,1,EA,EA,1,0.561,0.561,17
0143,Active,Box Master WF Saus Muf 4-12Pk,10495881,Box Master WF Saus Muf 4-12Pk,1,EA,EA,1,0.561,0.561,17
0144,Active,Box Master OP Brk Entree 24Pk,Master OP BEntree 24,Box Master OP Brk Entree 24Pk,1,EA,EA,1,0.4647,0.4647,17
0145,Obsolete,Cheese Cheddar Med 6-5Lb,06501-6,Medium Cheddar Loaf 6-5 Lb,1,CS,LB,30,2.2507,67.521,49
0146,Obsolete,Carton Wellshire Chix Bisc 2Pk,10499497,Carton Wellshire Chix Bisc 2Pk,1,EA,EA,1,0.1878,0.1878,17
0147,Obsolete,Carton Wellshire Ham Muff 2Pk,10499498,Carton Wellshire Ham Muff 2Pk,1,EA,EA,1,0.1878,0.1878,17
0148,Obsolete,Carton Wellshire Saus Muff 2Pk,10499501,Carton Wellshire Saus Muff 2Pk,1,EA,EA,1,0.1878,0.1878,17
0149,Obsolete,Carton Wellshire TBac Muf 2Pk,10499503,Carton Wellshire TBac Muf 2Pk,1,EA,EA,1,0.1524,0.1524,17
0150,Obsolete,Box Master Wellshire 12-2 Pk,Spec 55115,Box Master Wellshire 12-2 Pk,1,EA,EA,1,0.3577,0.3577,17
0151,Obsolete,Biscuit Natural 2 Oz Sliced,80891,Biscuit Natural 2 Oz Sliced,1,CS,EA,320,0.0883,28.256,50
0152,Obsolete,Muffin English Multigrain 2Oz ,62626,English Muffin Multigrain 2Oz ,1,CS,EA,144,0.1545,22.248,51
0153,Obsolete,Egg Patty Scram Cage Free 2 Oz,30012,Egg Patty Scram Cage Free 2 Oz,1,CS,EA,112,0.3452,38.6624,52
0154,Active,Susceptor Sleeve Eng Muffin,SK English Muffin,SBS/Adhesive/48 Gauge MPET,10000,EA,EA,1,0.1016,0.1016,30
0155,Active,Susceptor Sleeve Biscuit,SK Biscuit,Susceptor Sleeve Biscuit,10000,EA,EA,1,0.1044,0.1044,30
0156,Obsolete,Chicken Patty Natural 2 Oz,491,Fully Cooked Chicken Patty Nat,1,CS,EA,80,0.3125,25,10
0157,Obsolete,Sausage Patty Pork Natural ,337,Fully Cooked Pork Saus Patties,1,CS,EA,640,0.2044,130.816,10
0158,Obsolete,Bacon Turkey Canadian Natural,TBD Turkey Can Bac,Fully Cooked Turkey CanBac Nat,1,CS,LB,18,2.85,51.3,10
0160,Active,Sauce Teriyaki Glaze Kikkoman,4232682,Sauce Teriyaki Glaze Kikkoman,0,CS,OZ,480,0.091,43.68,1
0161,Active,Chicken Ginger Teriyaki Strips,5247,Ginger Teri Chick Brst Strips,1,CS,OZ,160,0.2178,34.848,6
0162,Active,Sauce BBQ TWB .6 OZ Puck,P17005,TWB BBQ Sauce 480-.6 Oz,1,CS,EA,480,0.0984,47.232,53
0163,Active,Asian Blend SK 40 Lb,BSK-ASIA-0040,Asian Blend SK 40 Lb,1,CS,OZ,640,0.0625,40,40
0164,Active,Rice White IQF Precooked 40 Lb,RWH-PRCK-0040,Rice White IQF Precooked 40 Lb,1,CS,OZ,640,0.0425,27.2,40
0165,Active,Ciabatta Bun Wheat Sliced,793,Wheat Ciabatta Bun Sliced,1,CS,EA,48,0.311,14.928,54
0166,Active,Kaiser Pan Wheat Sliced,413,Wheat Pan Kaiser Sliced,1,CS,EA,48,0.2973,14.2704,54
0167,Obsolete,Bowl Teriyaki 19 Oz Black,10499248,Bowl 19 Oz Micro Round Black,1,CS,EA,690,0.1623,111.987,17
0168,Obsolete,Lid Teriyaki Bowl Clear,10499251,Lid Teriyaki Bowl Clear,1,CS,EA,690,0.1551,107.019,17
0169,Active,Box Master Amtrk Teriyaki Bowl,60631 (Stock #),Box Master Amtrk Teriyaki Bowl,1,EA,EA,1,0.7635,0.7635,17
0170,Obsolete,Film Shrink Teri Bowl 14in 52G,D940 (Stock #),14in 52 Ga Cryovac Shrink,0,RL,IN,60600,0.0023,139.38,17
0171,Active,Bacon Turkey Half Slce Natural,871206LP,Bacon Turkey Half Slce Natural,1,LB,LB,1,10.17,10.17,21
0172,Active,Ctn Dipper French Tst Heinz,10492610,Carton Dipper French Tst Heinz,1,EA,EA,1,0.0778,0.0778,17
0173,Active,Ctn Dip Mini Pancakes Heinz,10492606,Carton Dip Mini Pancakes Heinz,1,EA,EA,1,0.0778,0.0778,17
0174,Obsolete,Carton Dip Mini Waffles Heinz,10492614,Carton Dip Mini Waffles Heinz,1,EA,EA,1,0.0778,0.0778,17
0175,Active,Syrup Cup 1.5 Oz Dipper,533500,Heinz Syru 1.5 Oz/100 Pack,1,CS,EA,100,0.1428,14.28,43
0175,Active,Syrup Cup 1.5 Oz Dipper,345415,Syrup Cup 1.5 Oz Dipper,0,CS,EA,100,0.1428,14.28,42
0176,Obsolete,Box Master Wellshire 18 Pk,Wellshire 18Pk,Box Master Wellshire 18 Pk,1,EA,EA,1,0.5647,0.5647,17
0177,Active,Ctn 4PK Ahold Bac Egg Bisc,Ahold 4PK Ctn BacBis,Carton 4PK Ahold Bac Egg Bisc,1,EA,EA,1,0.182,0.182,17
0178,Active,Ctn 4PK Ahold Ham Egg Crois,Ahold 4PK Ctn HamCro,Carton 4PK Ahold Ham Egg Crois,1,EA,EA,1,0.182,0.182,17
0179,Active,Ctn 4PK Ahold Saus Egg Bisc,Ahold 4PK Ctn SauBis,Carton 4PK Ahold Saus Egg Bisc,1,EA,EA,1,0.182,0.182,17
0180,Active,Ctn 4PK Ahold Saus Egg Croi,Ahold 4PK Ctn SauCro,Carton 4PK Ahold Saus Egg Croi,1,EA,EA,1,0.182,0.182,17
0181,Obsolete,Box Master Brkfst Sand 12-4PK,Master Ahold 12-4 Pk,Box Master Ahold 12-4PK,1,EA,EA,1,0.4699,0.4699,17
0182,Active,Box Master Panini 12 Pk,10517919,Box Master Panini 12 Pk,1,EA,EA,1,0.389,0.389,17
0183,Active,Box Master Nathans Twin,Nathans Single HD,Box Master Nathans Single,0,EA,EA,1,0.2807,0.2807,17
0184,Active,Box Master 13.5x10.5x9.5 ID,Spec 70842,Box Master 13.5x10.5x9.5 ID,0,EA,EA,1,0.425,0.425,17
0185,Active,Croissant TFF 30-2 Oz,6229,Croissant TFF 30-2 Oz,1,CS,EA,30,0.1594,4.782,47
0186,Obsolete,Ham Breakfast Stk Log 6-4.7 Lb,75180,Ham Breakfast Stk Log 6-4.7 Lb,0,LB,LB,1,3.2,3.2,12
0187,Obsolete,Carton 2PK GofC Bac Egg Bagel,GofC 2PK Ctn BacBgl,Carton 2PK GofC Bac Egg Bagel,1,EA,EA,1,0.2935,0.2935,17
0188,Obsolete,Carton 2PK GofC Egg Chs Bagel,GofC 2PK Ctn EggBgl,Carton 2PK GofC Egg Chs Bagel,1,EA,EA,1,0.2935,0.2935,17
0189,Obsolete,Carton 2PK GofC Saus Egg Bagel,GofC 2PK Ctn SauBgl,Carton 2PK GofC Saus Egg Bagel,1,EA,EA,1,0.2935,0.2935,17
0190,Obsolete,Carton 4PK GofC Bac Egg Bisc,GofC 4PK Ctn BacBisc,Carton 4PK GofC Bac Egg Bisc,1,EA,EA,1,0.172,0.172,17
0191,Active,Ctn 4PK GofC Ham Egg Crois,GofC 4PK Ctn HamCroi,Carton 4PK GofC Ham Egg Crois,1,EA,EA,1,0.172,0.172,17
0192,Obsolete,Carton 4PK GofC Saus Egg Bisc,GofC 4PK Ctn SauBisc,Carton 4PK GofC Saus Egg Bisc,1,EA,EA,1,0.172,0.172,17
0193,Obsolete,Carton 4PK GofC Saus Egg Crois,GofC 4PK Ctn SauCroi,Carton 4PK GofC Saus Egg Crois,1,EA,EA,1,0.172,0.172,17
0194,Obsolete,Box Master Bagel Sand 12-2PK,Master Bagel Sand,Box Master Bagel Sand 12-2PK,1,EA,EA,1,0.4696,0.4696,17
0195,Active,Box Master 12 Pk Flying J,Flying J Master,Box Master 12 Pk Flying J,0,EA,EA,1,0.4167,0.4167,38
0196,Active,Divider Chipboard 12.5x9.5,12.5x9.5 (.020) Gray,Divider Chipboard 12.5x9.5,1,EA,EA,1,0.0928,0.0928,17
0197,Active,Box Master WF 6-4PK SECC,9.5x8.5x13.5B26 SECC,Box Master WF 6-4PK SECC,1,EA,EA,1,0.4699,0.4699,17
0198,Active,Box Master Price Chopper 8-4Pk,10552351,Box Master Price Chopper 8-4Pk,1,EA,EA,1,0.504,0.504,17
0199,Active,Box Master PrcChop Bowls ,10552352,Box Master PrcChop Bowls,1,EA,EA,1,0.338,0.338,17
0200,Active,Box Master Clam Shell Jamba,Design 020019680,Box Master Clam Shell Jamba,0,EA,EA,1,0.404,0.404,38
0201,Active,Tape 3M 371 48mmx914M 1.9mil,372461,3m 371 machine tape,0,CS,RL,6,11.82,70.92,2
0202,Active,Ctn 4PK SausEggCrois WF,WF SECC 4 Pk,Carton 4PK SausEggCrois WF,0,EA,EA,1,0.1306,0.1306,55
0203,Active,Ctn 4PK HamChsCrois WF,WF HCC 4 Pk,Carton 4PK HamChsCrois WF,0,EA,EA,1,0.1306,0.1306,55
0204,Active,Chicken Bnls Wing Buffalo,6702,Buffalo Style Boneless Wing,0,CS,LB,10,2.9,29,6
0205,Active,Pork Pulled Smoked w/ Sauce,405128901,Smoked Pulled Pork with Sauce,0,CS,OZ,160,0.1669,26.704,56
0206,Active,Divider 12x9 Chipboard 20 Pt,10145853,Divider 12x9 Chipboard 20 Pt,0,EA,EA,1,0.0838,0.0838,17
0207,Active,Box Master Panini Jamba,10558596,Box Master Panini Jamba,1,EA,EA,1,0.372,0.372,17
0208,Active,Divider 9x9 Chipboard 20 Pt,10069550,Divider 8x9 Chipboard 20 Pt,1,EA,EA,1,0.0885,0.0885,17
0209,Active,Pickle Dill 3/16 Sliced Kosher,7578719,Pickle Dill Sli KK KO 3/16No Control,PL,EA,2250,,0.0127,0,1
0210,Active,Film Fuji Polish Baguetta CAN,0210 CAN,Film Fuji Polish Baguetta CAN,1,IMP,IMP,1,0.0426,0.0426,20
0211,Active,Film Fuji Bcn Chs Baguetta CAN,0211 CAN,Film Fuji Bcn Chs Baguetta CAN,1,IMP,IMP,1,0.0426,0.0426,20
0212,Active,Film Fuji Chsy Bf Baguetta CAN,0212 CAN,Film Fuji Chsy Bf Baguetta CAN,1,IMP,IMP,1,0.0426,0.0426,20
0213,Active,Film Shrink Perf 14in 60Ga,10071243,Film Shrink Perf 14in 60Ga,0,RL,IN,52440,0.0031,162.564,17
0214,Obsolete,LBL OP Hot Dog 3-5/8x3,P-039,LBL OP Hot Dog 3-5/8x3,0,CS,EA,8000,0.0347,277.6,25
0215,Active,Beef Patty Angus 4.5 OZ,445,Beef Patty Angus 4.5 oz ckd.,0,CS,EA,54,1.0659,57.5586,16
0216,Active,Lbl OP CBurger 3-5/8x3,P-037,LBL OP CBurger 3-5/8x3,0,CS,EA,9000,0.0347,312.3,25
0217,Active,Ctn 4PK Saus Egg Bisc WINCO,WINCO 4PK Ctn SauBis,Carton 4PK Saus Egg Bisc WINCO,1,EA,EA,1,0.1109,0.1109,17
0219,Active,Ctn 4PK Bacn Egg Bisc WINCO,WINCO 4PK Ctn BcnBis,Carton 4PK Bacn Egg Bisc WINCO,1,EA,EA,1,0.1109,0.1109,17
0220,Active,Ham Smoked Unsliced,201158,Ham Smoked Unsliced,1000,LB,LB,1,2.19,2.19,57
0221,Active,Ctn 4PK SausEgg Crois WINCO,WINCO 4PK Ctn SauCro,Carton 4PK SausEgg Crois WINCO,1,EA,EA,1,0.1109,0.1109,17
0222,Active,Ctn 4PK SausEgg Muff WINCO,WINCO 4PK Ctn SauMuf,Carton 4PK SausEgg Muff WINCO,1,EA,EA,1,0.1109,0.1109,17
0223,Active,Box Master WINCO 12-4PK,10508574,Box Master WINCO 12-4PK,1,EA,EA,1,0.59,0.59,17
0224,Active,Ctn 4PK SausEgg Muffin OP,OP 4PK Ctn SauMuf,Carton 4PK SausEgg Muffin OP,1,EA,EA,1,0.16,0.16,17
0226,Active,Ctn 4PK CanBac Egg Muff OP,OP 4PK Ctn CanBacEgg,Carton 4PK CanBac Egg Muff OP,1,EA,EA,1,0.16,0.16,17
0227,Active,Ctn 4PK Saus Egg Biscuit OP,OP 4PK Ctn Saus Bisc,Carton 4PK Saus Egg Biscuit OP,1,EA,EA,1,0.16,0.16,17
0228,Active,Ctn 4PK Bacn Egg Biscuit OP,OP 4PK Ctn Bacn Bisc,Carton 4PK Bacn Egg Biscuit OP,1,EA,EA,1,0.16,0.16,17
0229,Active,Box Master OP 12-4PK Value,OP Master 12-4 PK,Box Master OP 12-4PK Value,1,EA,EA,1,0.504,0.504,17
0230,Active,Muffin English Orig 3 Oz 80T,94024-3 Oz,Muffin English Orig 3 Oz 80T,1,CS,EA,80,0.1984,15.872,58
0231,Active,Muffin Eng Multigrain 3 Oz 80T,94022-3 Oz,Muffin Eng Multigrain 3 Oz 80T,1,CS,EA,80,0.2109,16.872,58
0232,Active,Film Lidding EZ Peel 16.54in,0232 Lidding Film,Film Lidding EZ Peel 16.54in,0,RL,IN,36000,0.0065,234,59
0233,Active,Film BOPP Fuji 9.5 In Web,SCR-25 9.5 BOPP,9.5 9,No Control,9842,FT,IN,0.0005,0,60
0233,Active,Film BOPP Fuji 9.5 In Web,9.5In Web 9842 Ft/Rl,Film BOPP Fuji 9.5 In Web,0,FT,IN,12,0.0005,0.006,61
0234,Active,Film BOPP Fuji 12 in Web,NSILB 12 Inch Web,Film BOPP Fuji 12 in Web,0,FT,IN,12,0.0007,0.0084,61
0234,Active,Film BOPP Fuji 12 in Web,SCR-25 12 Web,12 Web 9,No Control,9842,FT,IN,0.0007,0,60
0235,Active,Film BOPP Fuji 14.5 in Web,SCR-25 14.5 Web,14.5 9,No Control,9842,FT,IN,0.0008,0,60
